{
  "$schema": "http://json-schema.org/draft-07/schema#",
  "type": "object",
  "required": ["version", "initial", "states", "transitions"],
  "properties": {
    "version": { "type": "string" },
    "initial": { "type": "string" },
    "states": { "type": "array", "items": { "type": "string" } },
    "transitions": { "type": "array", "items": { "type": "object" } }
  }
}
